local,title,company,pay,reg_date
경기 안양시,TGIF 평촌점에서 같이 근무 할 주방팀원 모집합니다., T_G_I Fridays 평촌점,"11,000",37분전
경기 안양시,TGIF 평촌점에서 같이 근무 할 주방팀원 모집합니다., T_G_I Fridays 평촌점,"11,000",1시간전
부산 전체,홀파트 모집, TGIF광복점,"11,000",2시간전
경기 수원시,TGIF수원점 주방 파트타임 모집, TGI FRIDAYS 롯데몰수원점,"11,000",2시간전
경기 수원시,TGIF수원점 홀 파트타임 모집, TGI FRIDAYS 롯데몰수원점,"11,000",2시간전
경기 수원시,TGIF수원점 주방 파트타임 모집, TGI FRIDAYS 롯데몰수원점,"11,000",3시간전
경기 수원시,TGIF수원점 홀 파트타임 모집, TGI FRIDAYS 롯데몰수원점,"11,000",3시간전
대전 서구,"[TGIF대전점] 주방/홀 아르바이트 구합니다(시급11,000원)", (주)엠에프지코리아_TGIF롯데대전점,"11,000",3시간전
대전 서구,"[TGIF대전점] 홀/주방 알바 구합니다(시급 11,000원)", (주)엠에프지코리아_TGIF롯데대전점,"11,000",4시간전
경기 안양시,TGIF 평촌점에서 홀에서 함께하실분 찾습니다, T_G_I Fridays 평촌점,"11,000",4시간전
경기 용인시,(월별스케줄신청가능) TGIF롯데몰수지점 주방에서 함께할 직원구해요, TGIF롯데몰수지점,"11,000",5시간전
서울 전체,TGIF 롯데백화점 잠실점에서 근무하실 홀 직원을 구합니다., 티지아이프라이데이 롯데백화점 잠실,"11,000",18시간전
서울 강서구,TGIF/티지아이/김포공항점/주방/홀/평일/주말/파트타이머 모집, TGIF 프라이데이,"11,000",19시간전
경기 안양시,TGIF 평촌점에서 홀에서 함께하실분 찾습니다, T_G_I Fridays 평촌점,"11,000",19시간전
서울 전체,TGIF김포공항점 주방 파트 타이머 모집합니다.(초보자 가능), TGIF 프라이데이,"11,000",20시간전
경기 안양시,TGIF 평촌점에서 같이 근무 할 주방팀원 모집합니다., T_G_I Fridays 평촌점,"11,000",21시간전
경기 용인시,(월별스케줄신청가능) TGIF롯데몰수지점 주방에서 함께할 직원구해요, TGIF롯데몰수지점,"11,000",22시간전
대전 서구,"[TGIF대전점] 홀/주방 알바 구합니다(시급 11,000원)", (주)엠에프지코리아_TGIF롯데대전점,"11,000",07/17
부산 중구,TGIF광복점 조리파트 모집 중, TGIF광복점,"11,000",07/17
대전 서구,"[TGIF대전점] 홀/주방 알바 구합니다(시급 11,000원)", (주)엠에프지코리아_TGIF롯데대전점,"11,000",07/16
서울 영등포,TGIF 영등포점 주방 파트타이머 모집합니다, TGI FRIDAYS 영등포점,"11,000",07/14
경기 용인시,(월별스케줄신청가능) TGIF롯데몰수지점 주방에서 함께할 직원구해요, TGIF롯데몰수지점,"11,000",07/13
경기 용인시,(월별스케줄신청가능) TGIF롯데몰수지점 주방에서 함께할 직원구해요, TGIF롯데몰수지점,"11,000",07/11
경기 용인시,(월별스케줄신청가능) TGIF롯데몰수지점에서 주방직원 채용합니다., TGIF롯데몰수지점,"11,000",07/09
서울 영등포,TGIF 영등포점 홀/주방 알바 모집합니다, TGI FRIDAYS TG영등포점,"11,000",07/07
