local,title,company,pay,reg_date
서울 강남구,[주휴수당지급] 세븐일레븐 수서역사1호점 평일 미들(12-18) 모집, 세븐일레븐 수서역사1호점,"9,160",2분전
충북 진천군,세븐일레븐 진천읍내중앙점 평일오후 아르바이트 구인, 세븐일레븐 진천읍내중앙점,"9,160",3분전
경기 수원시,수원곡선로점 주말 오후 아르바이트 모집합니다., 세븐일레븐 수원곡선로점,"9,160",4분전
인천 서구,주말 야간 알바 모집 (일요일), 세븐일레븐 청라초교점,"9,160",5분전
경기 수원시,"수,목요일 야간 근무자 구합니다.(23시부터 07시까지)", 세븐일레븐 수원정자의료원점,"9,160",5분전
인천 서구,주말 오후 아르바이트 모집 (토요일 오후 4시 ~ 11시), 세븐일레븐 청라초교점,"9,160",5분전
대전 유성구,세븐일레븐 주말 야간  알바 모집 합니다., 세븐일레븐 대전관평점,"9,160",6분전
서울 송파구,세븐일레븐 풍납사거리점 함께하실분 모집, 세븐일레븐 풍납사거리점,"9,160",6분전
대전 유성구,세븐일레븐 주말 야간  알바 모집 합니다., 세븐일레븐 대전관평점,"9,160",6분전
대구 남구,"세븐일레븐대명푸른빛점에서 오후,야간 일할친구구해요", 세븐일레븐 대구대명푸른빛점,"9,160",6분전
경기 파주시,세븐일레븐 금촌스타점에서 근무자 모집합니다., 세븐일레븐 금촌스타점,"9,160",7분전
서울 용산구,세븐일레븐 후암광장카페점 금. 토. (주간) 일. 야간 아르바이트 모집합니다, 세븐일레븐 후암광장카페점,"9,160",7분전
제주 서귀포,세븐 일레븐 중문점 아침 근무자 모셔요, 세븐일레븐 서귀포중문롯데점,"9,160",7분전
부산 북구,평일 야간구함, 세븐일레븐 부산구포유보라점,"9,160",8분전
인천 미추홀,"평일단기알바구합니다(화 수,목,금) 요일은 선택가능", 세븐일레븐 용현유원점,"9,160",8분전
서울 중구,청계점 오후 근무자분 모셔봅니다, 세븐일레븐 청계퍼시픽점,"9,200",8분전
경기 안성시,성실한 아주머니 구합니다, 세븐일레븐 안성진촌점,"9,160",9분전
서울 강서구,세븐일레븐 등촌5호점 주말심야 알바구함, 세븐일레븐 등촌5호점,"9,160",10분전
경기 수원시,"일,월,화 야간 근무자 구합니다.(23시부터 07시까지)", 세븐일레븐 수원정자의료원점,"9,160",11분전
서울 성북구,"[직영점] 평일 오전(8-15), 오후(15-22), 주말 오전 오후 구인", 세븐일레븐 성북문화점,"9,160",12분전
서울 강서구,"금,토 야간알바 구합니다.", 세븐일레븐 화곡푸른점,"9,160",12분전
경기 의정부,평일야간( 목)23시~08시)아르바이트 모집합니다., 세븐일레븐 의정부태평점,"9,160",12분전
광주 북구,세븐일레븐 광주중앙점(직영점) 주말스윙(18~22시) 모집, 세븐일레븐 광주중앙점,"9,160",12분전
경북 구미시,세븐일레븐 구미상모베스트점에서 메이트 구합니다., 세븐일레븐 구미상모베스트점,"9,160",13분전
대구 전체,세븐 대구신암남로점 평일(월~금)/오후2시~밤10시까지입니다, 세븐일레븐 대구신암남로점,"9,160",13분전
경기 부천시,(직영)세븐일레븐 부천약대점 주말 모닝 메이트 구인합니다, 세븐일레븐 부천약대점,"9,160",13분전
광주 광산구,토요일 야간(22~10시)구합니다.(문자지원), 세븐일레븐 광주첨단부영점,"9,160",14분전
서울 강동구,주말오후 근무자 구함, 세븐일레븐 강동경희대병원점,"9,160",14분전
충남 홍성군,평일 새벽 07시~09시 알바 구합니다. 주말 포함 오후 21시 새벽 1시, 세븐일레븐 홍성옥암점,"9,160",15분전
대구 전체,"세븐일레븐 대구율하광장점 평일, 주말 야간 근무자 구인", 세븐일레븐 대구율하광장점,"9,160",16분전
경기 평택시,청북부영 세븐일레븐 주말 근무자 구합니다, 세븐일레븐 평택청북부영점,"9,160",17분전
경기 김포시,단기 알바 구합니다 (20일), 세븐일레븐 김포지오프라자점,"10,000",17분전
경기 화성시,세븐일레븐 주말 오후 근무자 구합니다, 세븐일레븐 롯데뉴스테이반월점,"9,160",18분전
경기 수원시,편의점알바모집, 세븐일레븐 수원곡반타운점,"9,160",18분전
경기 용인시,[평일오후] 함께 근무하실 근무자 구인합니다., 세븐일레븐 기흥상하대로점,"9,160",18분전
서울 성동구,[세븐일레븐 성수공단점] 평일 월-금 22-07시 근무자 구합니다, 세븐일레븐 성수공단점,"9,160",19분전
울산 북구,주말 오후 근무자 구합니다, 세븐일레븐 울산염포현대점,"9,160",19분전
서울 송파구,세븐일레븐 송파방이점에서 주말 야간알바 구합니다~, 세븐일레븐 송파방이점,"9,500",21분전
경기 남양주,진접반도프라자점 세븐일레븐 평일 마감 아르바이트생 모십니다, 세븐일레븐 진접반도프라자점,"9,160",21분전
인천 미추홀,평일단기알바구합니다, 세븐일레븐 용현유원점,"9,160",21분전
부산 부산진,편의점/여알바(수저녁.토격주저녁1명)시급.시간최고, 세븐일레븐 부산개금주공2단지점,"9,160",22분전
경북 포항시,세븐원동프라자점 평일저녁 알바 구해요, 세븐일레븐 포항원동프라자점,"9,160",22분전
경기 수원시,주말 야간 메이트 구인, 세븐일레븐 수원호매실원룸점,"9,300",22분전
경북 포항시,세븐일레븐 원동프라자점 주말알바 구해요, 세븐일레븐 포항원동프라자점,"9,160",22분전
경기 안성시,매주 일요일 오후3시부터 오후22시 주1회 알바 구합니다 (문자지원필수), 세븐일레븐 안성대림타운점,"9,160",23분전
경기 수원시,"야간(일,월2일) 메이트 구인", 세븐일레븐 수원호매실원룸점,"9,200",23분전
경기 용인시,세븐일레븐 포곡중앙점에서  일월화마감근무자를 구합니다, 세븐일레븐 용인포곡중앙점,"9,160",23분전
서울 강동구,주말야간근무자구함, 세븐일레븐 강동경희대병원점,"9,160",24분전
경기 용인시,세븐일레븐 포곡중앙점에서  금토마감근무자를 구합니다, 세븐일레븐 용인포곡중앙점,"9,160",24분전
경기 남양주,진접반도프라자점 세븐일레븐 평일 오전 근무자 모집합니다, 세븐일레븐 진접반도프라자점,"9,160",25분전
